Gamming,Hardware,Internet,Security,Smartphone,Software and App
how can i choose which runes i should get in league of legends?,can two cpus work in parallel in one machine?,satellite,what are the applications of ml in cyber security?,what does liquid ip rating really means? it also grants lower ip protection?,where do i go to get free makeup sample products?
how do you beat the rotten in dark souls 2?,is it possible to have a computer at home with no monitors and have multiple monitors at my machine where i remotely log in?,radio-signal,what do cyber security professionals feel about bringing internet connected appliances like refrigerators and amazon echos into private homes?,why was the first cell phone invented?,how does will call work on ticketfly?
does e-sports stand for anything?,what is the best commercially available graphics card?,signal,how do i decide between a career in security engineering and software development? is it easy to switch to the other later?,what will happen if i charge my water resistent mobile after dropping it in water?,how do computers work the way they do? when does electricity become executable logic and how?
"would it be possible to make a videogame where its world gets shaped dynamically while the player explores it? it would create npcs, weapons, quests, landscapes, creatures by randomly meshing up a potentially infinite number of “source” elements.",are weaker arm processors necessarily more power efficient?,wifi,"if anonymized data is vulnerable to reidentification tactics, how can it ever be considered safe?",is it technically difficult to make lcd's minimum brightness lower?,how do i begin a career in machine learning in india? what are prospects of ml in india? which oss are better to work on to gain a good experience in ml?
minecraft command block vs. infinity gauntlet—which one wins (assuming someone is actually using the gauntlet)?,is it better to blow more air in or take more out when trying to cool a computer?,wi-fi,what are the best certifications to get when starting a job in computer science/cybersecurity? are there any that might be detrimental?,what are some little red dots displayed on my iphone?,what are the best strategies for getting management to accept code refactoring tasks?
"which video games were ahead of their time in graphics, gameplay or story?",humans are often the weakest link in the chain when it comes to computer security. so how can we stop doing silly things that play into the hands of cyber criminals?,wml,how is it possible that a miner having a low hash rate can find the required hash before a miner with a higher hash rate in bitcoin mining?,what's the best/cheapest way to get an emergency-only sim card in the us for a year or more?,how can ios better their operating system?
why do parents hate on video games but often spend hours in front of a tv?,why are gaming pcs so bulky and unwieldy?,wireless,what is the formal explanation as to why adversarial model like one pixel attack works against neural network?,how many m.e seats are there in bits pilani for microelectronics?,what are the best and free mockup tools for website (ui) design?
how do you play video games to make them more enjoyable?,is it possible to stop a factory reset on your pc after it has started?,network,"is the us at risk of ""fighting the last war"" with respect to state sponsored cyberattacks?",what are the best books on mobile application startups?,why is linux mostly used for software development?
how do you evaluate the game bethesda rage 2?,is there any software to overclock locked intel xeon processors/ram? bios hack to unlock?,nternet,"from a security perspective, is it better to hash a password multiple times instead of just once?",what is mb in phones?,how important is the microsoft office specialist (mos) exam for excel? is it worth it?
what video game has the biggest map?,are there any eighties 'style' low performance computer kits available that really allows child programmers to engage with and understand the hardware?,web,what are some good kpis for a vulnerability management program?,how do parents feel about looking through their child's phone?,"why does t-sql have a dedicated ""not less than"" operator when you could just use the ""greater equals"" operator instead?"
how can i keep myself from getting so angry at video games?,why do supercomputers require so much power for operation?,webpage,how do you see a saved wi-fi password on android without root privileges?,does any mobile phone carrier provide similar call & data prices to avoid buying sim cards in both countries?,what is the best crm software combined for backlinking?
is it possible to make a aaa quality game as an indie games developer?,"what is haswell, ivy bridge on intel and how they are different from i3, i5,i7?",website,is it possible to use windows single sign on to authenticate into a web application which is hosted outside of a company network?,what are some innovative ways companies could leverage fingerprint sensor on mobile phones?,what is the best free/cheap video editing software for pc?
what childhood video game do you still play as an adult? why does this game have you hooked?,why doesn't apple use amd zen / zen + processors in their products since they are so good?,server,how do i disable encrypted file indexing on windows 10?,how can i stop the low hissing sound coming from the speakers in a leeco le 2?,what file system does osx use?
why are indie developers making better games than aaa studios?,is the soldered “ram t2 chip”/“osx proprietary hardware locking” the strongest base for the united states to bring a lawsuit against apple inc. (title 15 of the united states code) or not?,client,"how do we see quantum computing affecting businesses as it relates to cybersecurity, internal wpa3 securities, and related matters?",how long should i daily charge a mobile?,are we all computer programs created by ourself?
how would you rank all of the dlc packs for the sims 4?,why did nvidia win the gpu market?,vpn,how do i unlock bitlocker without a recovery key?,should i start with the android studio or should i start with cross platform development like xamarin/unity?,what is it like to program?
"assume i make a really fun pc game. when it comes the time to ship it, will it have a harder time gaining popularity due to some peoples' (perhaps incorrect) perception of unity, being that i used unity?",what is a plausible path (if any) towards ai becoming a threat to humanity?,fiber,why is it important for computer's security to differentiate between data read and instruction fetch memory access?,which is the best android app for learning mobile photography?,which is better between macbook pro and dell xps 13 for programming?
which pc game is your favourite and why?,"chromebooks are cheap - but why do schools think it is ok for kids to think they can be dependent on a hardware/software ecosystem made by one company, google?",webserver,what are the credentials that one should look for in hiring somebody for cybersecurity? it would seem to me very difficult to do successful due diligence in this area. any suggestions?,did steve jobs feel cheated after other companies released smartphones?,could you translate adobe photoshop into pure assembly?
what is the most pleasing thing to do while playing any video game?,why aren't korean companies as competitive in the software industry as they are in hardware?,browser,my antivirus warned me 'dns: device is vulnerable to attacks' of my router. how to fix this?,"as i was walking towards my phone, the speaker button turned on without me touching it and the caller started talking to me. how is this legal?",what is that mobile app you start your day with?
which video game does choices and consequences the best?,what is the best method of extracting data from a hard drive that won't mount?,download,what types of attacks can hackers do once inside an organisation's network?,is a strong torch at half brightness or a weak torch at full brightness more power efficient?,has anyone designed software for mission critical applications? how different is it from regular software engineering?7are software development companies needed to be hipaa compliance (besides from their product)?
"in games like skyrim or fallout: las vegas, how can player-made mods restore cut content?",what's the fastest and easiest way to clone a harddrive?,adblock,is there any way to reset passcode attempts?,if you were able to build your own smartphone what would the specs be?,"despite so much of testing, how can bugs still present in the post-release of a software?"
how are video games marketed?,how many buttons on a mouse is too many?,activex,what are the differences and similarities between a security key and sms two-factor authentication? can they be used them simultaneously?,"what happens if i put a 4g internet pack in my airtel 4g sim, but my phone is only 3g compatible?","my laptop technician said he didn't partition my new ssd because it would slow it down. if so, why do people generally go for partitioning?"
"what is the most addicting, ""crack-like"" video game you've ever played?","why would my fans be very loud, but my laptop is not overheating or anything else? the fans are just very loud and it wasn't like that before. i am just using it as normal internet browsing. the dust has already been cleaned out.",adsense,how do i see a saved wifi password?,which is your best clicked selfie?,what is the best software for plotting 3-d vector spaces?
what is the best mod in ksp?,"if you eject a usb-connected device from your computer and it becomes ""safe to remove,"" does it become unsafe to remove again after you perform any specific actions or wait enough time?",adwords,what are some tricks to help remember your passwords?,would a software method for filtering blue light to reduce eyestrain on mobile devices be just as effective as a physical blue light screen filter ?,why does the military still use the waterfall software engineering process instead of agile?
what beginners video games for adults do you recommend?,why do graphics cards seem like they are getting larger while cpus are getting smaller?,amazon,why are these massive companies storing passwords in plain text?,how are cell phones used to trigger a bomb?,what are the must have and nice to have tools for a saas startup?
how can someone turn 180 degrees and shoot me in cs:go?,what is an sli connection? what are its uses and shortcomings?,anonymous,"if you had to both compress and encrypt data during a transmission, which would you do first?",do smartphones have a charging circuitry designed to block the incoming charge?,what are the latest hot tools used in software engineering?
what celebrity would you most like to play video games with?,"how can i make my imac run cooler? it's a top specification 2018 model, retina 5k with radeon pro 8gb, 4.2ghz i7, 40gb ddr4 and 500gb ssd, no mods - but the fan goes at top speed well within cpu and gpu limits.",anycast,"how is google cloud firestore actually hipaa compliant (circa may 2019) if firestore security rules require firebase auth, which is not hipaa compliant?","what happens, if i connect two phones or powerbanks with the same battery capacity to each other using usb-otg?",how hard is it to intentionally get a bug merged into open source software?
what is the greatest ai that video gaming has ever brought forward?,does software affect camera quality? is it as important as the hardware?,arpnet,is it safe to give credit card details in email?,can console games run on mobile phones?,which is the best cloud accounting and inventory software for business owners?
what is the best gaming contoller for a pc?,why is it that powerful desktop processors like the intel core i7-8700k processor can't be used on a laptop? since a laptop battery can power it up.,backlink,"why is it not secure to use https, if it isn't, when using public wifi?",what are some of your favorite background images for electronic devices?,"due to the inherent imprecision of floating points, how do you accurately program something that must be precise? things like rockets, missiles, aircraft navigation systems, and even financial transactions."
what is a fun and simple online flash game to play just to waste some time?,who came up with keyboarding signals?,chrome,how do mcafee and norton differ?,"which is better, repairing your broken phone or replacing it with a new one?",have you ever left bugs in software code on purpose? why?
how do you beat nashandra in dark souls 2?,what are the best pc ram kits of 2019?,safari,can windows malware applications also infect other operating systems such as linux and mac?,i want to know about call drop. is it a problem when we call someone but it's connected somewhere else?,"did steve wozniak have more knowledge of hardware, while steve jobs had more knowledge of software?"
is it possible to build a gaming pc with $450 in 2019?,what is the fastest cpu that does not need cooling?,opera,is the bbc’s advice on choosing a password sensible?,will an unlocked phone bought in england work with a french simcard?,"can you be a successful software engineer without being interested in linux, computer culture, open-source, and the wider programming community?"
can a dual socket lga 771 workstation be used as a gaming pc?,is it possible to make a distributed pc using a bunch of wireless transmitters/recievers attached to each component?,tomcat,which nation's hackers pose greatest cyber security threat to united states?,what was the importance of cellphones in 1996?,what is the best free email program?
why is there a babel tower in so many rpgs?,do computers depreciate faster than cars?,apache,are windows rootkit techniques a lot more different than the linux rootkit techniques?,is it legal to implant a microchip in yourself?,what is the weirdest computer repair you have done?
did the price of a game depend on the number of disks before the digital era?,"i broke my colleague's laptop screen, should i tell her?",iis,is vilnius university lithuania good to study information systems and a cyber security bachelor’s?,why is my vlc only playing the audio but not the video (mobile)?,what is the best software for saas customer success management?
why do people cheat in video games. doesn't it ruin the fun?,should i buy a liquid cooling system to overclock my current cpu (ryzen 1600) or should i wait for the ryzen 5 3600(x)?,firewall,how do i become a cyber security professional?,how can a text msg be sent from a mobile phone in the owner's possession without the owner knowing?,what is the best alternative to toutapp?
"how do i stop my son from playing games when he has so many ways to play games (tablet, phone, desktop, laptop, ps4, another phone)?",should i upgrade to ryzen 5 2400g or add an rx 570 to my athlon 200ge?,webservice,what are the best resources for a beginner to learn about cybersecurity?,will windows mobile ever come back to life?,why is it taking boeing so long to provide the software patch for the 737 max?
will video games ever become fully immersive?,how much ram memory is required for a computer system to copy a 500 gigabyte file from one storage device to another?,cloud,why don't email spammers get caught?,why was motorola successful with moto g phones?,which app help me to import product from etsy to shopify store?
what video game deserves a good movie?,what's more expensive to buy a smart speaker or to build one with a raspberry pi? (without considering the time),cloudserver,may i know what is the job opportunities for cyber security and what is all about cyber security?,how do i set a break-in alert if someone tries to open my phone?,what is the best app to record both sides voip calls?
why did sony lose exclusivity with square enix's final fantasy franchise even though sony can afford to keep other giant video game series exclusive?,how do surface laptops compare to apple macbooks?,cloud computing,"as per salary, which field is better: penetration testing or cyber forensics?",how can my phone identify a physical web?,"the fact that nokia was a dominant force in the mobile market and they failed badly in the end, can the same thing happen to apple?"
are gaming pcs good for using blender?,do all cars have a usb diagnostic port?,ftp,"is biometric security the safest, or is it just a false sense of security that is easily bypassed?",should movie theaters ban the use of cellphones?,what should i do if my apps won't update on my smartphone and it says pending?
what is the difference between rpg and mmorpg?,"do professional video game streamers use one computer to do everything or do they split up the workload between multiple machines? if so, how do they divvy up the workload between machines? are the specs different?",hyptertext,does the fact that wordpress is developed in php make it more vulnerable in terms of security to potential attacks?,is it safe to read books on an iphone 6s plus? are there any specific guidelines i should follow while reading on the smartphone?,what are some alternatives to shopify? are there any free e-commerce site building or hosting apps like shopify?
what is the name of the video game where you clean up after heroes go through a level?,how much ram should i get to future proof my system?,transmission,do i have to know ccna for a cybersecurity job? how much networking do i have to know for a decent cybersecurity postion?,do magnets on phone covers drain battery life?,why does microsoft monetize obsolete windows versions?
how can we create self help tools as a video game?,"what modern computing device, say from the last 20 years, is equivalent in performance to the cray-1 supercomputer in flops?",mail,how can i protect my house from any unwanted intrusion?,how do cellphone towers work? i mean how do they direct calls to the right phone numbers?,"if you have a professional job in some other field but have built multiple software applications on the side for 10 years that you can demonstrate, can you find a software role that will pay you as if you had 10 years of salaried software experience?"
can i still play fortnite if i have bad internet?,how do i get my desktop back?,gmail,what are https design security defects?,why is my iphone 6s's battery fading overnight without usage?,why are linux and unix so similar?
"the last boss from the recent video game you played are after sora, goofy and donald duck. how screwed is sora(kh) now?",why do macbooks no longer have dvd drives?,hotmail,what are some ways encryption won't protect your privacy?,"which is better at voice recording, the macbook's internal microphone or a high-end mobile phone?",what is a good time tracking app to use for a small business?
i’ve seen a mod of re2 remake where characters are only wearing a g-string. are muscles and skin already coded in the original game and the mod just takes clothes off to reveal them? or are they added by the mod?,is there a software or hardware that can be used to improve the picture and sound quality of old vhs tapes?,yahoo,have you ever bought a used laptop or hard drive that still contained the previous user’s data?,what specifications shall i choose in mobile phone ?,what are some good 'passive' or automatic time tracking software for windows and android?
is it worthwhile for a student to build mid-range gaming pc‘s (~900-1000 us-d) to sell for additional income?,is there such thing as a 240hz 4k monitor?,twitter,how serious is a hipaa violation?,who was the first person to own a wireless cell phone?,"is an ""application developer"" the same as a ""software developer""?"
why have computer games displaced sports and outdoor games with kids today?,why don't many people keep their laptops longer just by upgrading to ssd?,facebook,what is a cybersecurity analyst?,how do you play music from your phone on a guitar amp?,how do i make my own set of brushes when new file open (photoshop)?
what game needs a sequel?,is it a bad idea to buy a 2018 macbook pro even though it has many issues or should i wait for the 2019 iteration that debuts in september/october?,google,how effective is a home security system (alarm) at preventing a burglary or home invasion?,"is there a phone that enables you to permanently and irrevocably disable web browsers/e-mail apps, but does allow you to use spotify and google maps?",why do some companies open-source even their core products' software which someone can readily use to create a competing product?
do video games make you hungry?,how do i format a usb drive as a single fat partition?,php,what is credential stuffing?,why do i get this picture and how do i change or remove it?,"how can i find out, if anyone or anything, in the world, is spying on me, through my phone is there a app, or method, i can do, to see if this malicious intent is happening?"
how good can video game graphics get before we hit a wall?,ordered a processor from amazon and got an empty box. what should i do?,traffic,"what should i do to decide which area in it to choose: security, development, big data, cloud computing, iot, network technologies, etc.? which area is the best? (i like everything)","pokémon go: will this game be as popular in the uk, as it is in the usa?",what innovations could a new functional language bring?
when was modding support released for half-life 2?,how do i connect a printer through ethernet cable?,wired,"given that no one, except perhaps those with ill intent, needs to know the location of any cloud services company’s datacentres, what’s the point of wikileak’s latest “revelation” on aws?",what are some best mobile phones under rs 6k in india that don't hang on browsing/ watching youtube videos and playing light games?,are programs for commodore still being developed?
where do you buy your games? do you have different places for different types of games?,when do you use your monitor in portrait mode?,darkweb,which cybersecurity incident compelled everyone to take cybersecurity seriously?,"i kept my old whatsapp, and keep sending and receiving mgs with it. i am concerned about my privacy.",what inexpensive software is available for writing music?
what is the best mode in mortal kombat 11?,will intel and amd continue increasing core count or will they start to make existing cores faster?,dhcp,"is all the data handled through my https website encrypted (i.e. form data), or is there something else i need to do to encrypt it?",can i connect my phone to tv so i can use my tv’s wifi?,what is a good alternative to adobe after effects?
how do i start collecting retro video games?,i reinstalled my win10 it changed my ram from 12 gb to 4 gb ? what can i do to solve this?,ipv4,what is the best pr strategy for a company after an information security incident?,does verizon have more coverage than at&t in us?,what is software outsourcing?
what video games has the best soundtrack?,"now that phones are becoming more powerful than computers, why don’t they need a cooling system?",ipv6,do you think the advancement of cyber warfare may impact the development and use of driverless cars?,which are the smartphones that can play 4k videos smoothly without any lag?,operating system
what is the best docsis 3.0 cable modem for gaming and why?,what are the disadvantages of a zip disk?,stream,what is a private security firm? what are some?,is it possible to have a multi-network sim card that can register on any network assuming that the networks allow this?,what’s the difference between a binary and general semaphore?
can you list 15 video games in which the villains won?,how do you destroy an old hard drive?,online ,is telegram's encryption interception-proof? is it secure against the police or other institutions?,how many of you have purchased the 1 assist insurance for your expensive new smart phone?,why was lucky patcher not working?
how do you beat dragonrider in dark souls 2?,"i have an amd fx 4100 quad-core cpu, the motherboard is the asus m5a87 dual channel, 4 slots with 16 giga ram maximum memory allowance. what is the best way to upgrade ram? 2x8 or 4x4?",offline,what are the pci dss standards?,"if the characters in the great gatsby had cell phones, what text messages would be sent?",is it possible to license a project which is already released without a license?
why is there so much controversy over easy mode in gaming?,what special steps need to be taken to make backups bootable with a 2018 or 2019 mac?,firefox,what uses are there for a symmetric encryption algorithm that cannot be broken with brute force?,why does the quora app make my phone so hot?,"post the acquisition of appsee by servicenow, what alternate tools can appsee customers switch to?"
how do you beat dark sun gwyndolin in dark souls?,why does the address bus point from the cpu to the main memory and to the i/o?,service,what is the best protection against cyber threats and ransomware?,can installing a custom recovery on an android device brick it?,"should a software engineer join a startup where there'll be opportunity to build impactful software from the ground-up, even though the pay is less?"
how do you beat giant lord in dark souls 2?,can a pentium pc run windows nt 3.51?,brandwidth,how do sql injection attacks work?,can i save mobile display that has been leaked by water?,what are the key attributes of a world-class feature in software development?
what video games have made huge comebacks?,how do i compare the onboard sound card and dedicated usb/pci sound card in linux?,broadway,"what are the differences and marketability of different certifications such as giac from sans, ceh from ec-council, cissp from (isc) 2, cism from isaca, etc.?",how do i recover lost contacts on a windows phone?,what tools do i need to have to become a software developer?
