Gamming,Hardware,Internet,Security,Smartphone,Software and App
what are the best video games for children under the age of 15?,how true is amd filing for bankruptcy?,"should you use a vpn when using a public wifi spot? if so, which vpn?","what sort of anti-virus software do iphones have, if any?",does the samsung galaxy 7 iris scanner really provide good security?,"if i wanted to create a website that will eventually be converted into an app, would it be easier to just code the app first?"
what is your favorite ‘bad ending’ in a choice driven video game?,is 8gb enough ram memory for a laptop in 2019?,will serverless programming replace servers soon?,what is the best current method of encryption?,"how do i buy an old, non-gps mobile phone?",which is the best accounting software?
"when building a custom gaming pc, which brands should i avoid?",why couldn’t vga cables be described as something else other than “male” and “female”?,who provides internet access (isp) for google?,how much could a professional hacker expect to earn in a year?,what are the elements (available inside a retail shop) that influence a customer to choose a particular mobile brand over other mobile brands?,what is a 'bug that became a feature' in real life?
where do you want to see the next far cry game take place?,how often does your computer system at work crash?,how come 20mbps of dsl is better than 80mbps of fiber internet?,can i work in cybersecurity or get a job in this field without any certification but had a degree in cyber security?,how can i retrieve my phone which was stolen this morning while getting down from the bmtc bus in bangalore?,will i be expected to write unit tests during a whiteboard interview for a software developer position?
how do it get my daughter uninterested in violent video games and into more girly things?,what would happen if laptops didn't have cooling fans?,why hasn't ethernet gotten any faster in the last 15 years?,do i need kaspersky to be completely secure from viruses?,which is the cheapest and best cell phone?,"should i go to microsoft (~110k) or slack (~135k) for my first software engineering full-time job, if my goal is to be in the best financial position in about 5 years? both have great projects/teams, and both offer the same location."
who are the most underrated rainbow six siege operators?,what are some of the best pc case fans in terms of high airflow with minimal noise?,what are some interesting hacks in javascript and jquery?,"is it safe to store the encryption key in the same folder with the encrypted data (as you know, to import the key, we need a password)?",who can see what i do on my phone?,what killed icq?
what is the most important skill to consider when starting out as a twitch streamer?,how do i start rebuilding the catalog b-tree on a macos sierra external hard drive?,what are the latest/trends in web development technology?,what are intel cpu mds security flaws?,how do i recover from this state?,does microsoft have the right to put unnecessary software on your computer?
"in the division 2, how do you invite random people to your group?",how do you switch between windows and mac with mouse?,"what are the little pictures, words, symbols, logos, etc called that appear on tabs in google chrome?",is it easy to hack into a hotmail account?,how can i import mobiles from china?,what are the things that a software engineer manager knows but will never tell the engineers he or she manages?
why is the option to show yourself as offline allowed on steam and skype? is there a practical reason to use this?,what are some cool quirks and features of the raspberry pi?,which web technology is the best in 2019?,what are your worst internet and computer mishaps?,which are the best android phones between 12000 and 18000?,how do i install an emulator to write cobol programs in a windows pc?
is it a good time now to build a gaming pc?,how are 1's and 0's translated to a change in voltage level (in other words how does this mapping happen at the hardware level)?,what are some useful remote server management and monitoring tools?,how do you prevent a software virus?,why does my software update icon have an exclamation point over it?,"if you had a program that multiplied each pixel by 4, couldn't you enlarge an image without losing quality?"
"what ""g"" rated video game would you recommend to parents who don't allow their kids to play video games?",can a min-heap data structure be implemented on the hardware level?,is data scraping legal in the uk?,will quantum computing make rsa encryption obsolete?,is starting a mobile app development company a bad idea?,are you developing software in c? what kind of software is it?
what's the best response time for a gaming monitor?,"why is it possible to combine several gpus, but not cpus?",what technology is involved in the google art project?,i got accepted to ucla for their political science program. and i also got accepted to csusb for cybersecurity. which path should i take? is the prestige worth it? or should i pursue cybersecurity at a school no one knows about?,how has mobile phones changed africa?,what software would you be least likely to recommend?
how do you beat crossbreed priscilla in dark souls?,my laptop doesn't have enough ram to handle android studio. what can i do besides buying a new laptop?,which web technology do i need to use for handling millions of users?,who is spreading triton malware? how can we protect our system against it?,what is the importance of choosing the color while designing an app?,what is the best video editing software i can get for free?
what is the most overhyped/disappointing game that you have ever played?,in what ways are amd ryzen processors better than intel core processors?,"what is meant by remote server management, monitoring tools?",what is the rarest cybersecurity skill?,can you put a 2g or 3g simcard on a 4g phone?,are there any good software companies in europe?
what is the future for twitch?,"how come my computer has issues turning on after it gets turned off? when i go to turn it back on, i hear the fans start up but nothing shows up on screen. i have to unplug every cable from it to get it to turn on properly. whats going on?",how many companies are actually using marketing automation software?,"why haven't tech giants like google, facebook, etc., replaced passwords with a technology like trusona?",i am interested in photography and videography. which phone would be the best under rs 30000?,"what tools or programs do you use, and would reccomend, to manage your team and assign tasks?"
did minecraft copy another game?,what is the most amount of storage you can get in a laptop hard drive?,what are team dynamics in web technology?,what is the best free anti-malware for windows compters?,how can i earn unlimited uber money in india? what is the trick?,"pico/nano is garbage compared to vim/emacs and if you want to really be a linux guru, you don't *ever* use pico/nano. so what is the deal with readmes suggesting people use nano for file editing nowadays?"
what are the elements of a great game?,what is the best way to ensure the usb ports of my laptop don't wear out?,what are some websites or blogs for keeping up with web technology?,security: why do homes still have mechanical key locks rather than combination locks or electronic locks?,which is the best seller of mobile phone in online marketplace?,why don’t most apps provide customers with a contact number to contact customer service?
why does sony charge video game players a monthly subscription for ps plus to play online multiplayer on the ps4 while the same games released for pc have free online multiplayer?,my seagate 1tb backup plus is not showing up on my computer. it has vibrations and lights like normal. it doesn't show up in disk management but shows up in device manager and devices in control panel?,how does google polymer compare to react?,what makes the bitcoin network secure?,my galaxy s2 has 2gb of device memory and 12gb of 'usb storage'. how can i download apps to the usb storage instead of device memory?,why is the start menu in windows 10 getting its own exclusive process? why is this a big deal?
why is fortnite so popular among adults?,how do i know what is the best computer case for my custom made desktop computer?,what is the best web technology to create a marketplace kind of website?,who is behind the fake online ads such as computer virus ads?,how do you reduce echo in a cell phone when speaking?,how can i hide apps on apple tv?
"what are some tips for 'free to play' gamers to complete with paying, premium players in games like fortnite and such?","what is “zombieload,” and is it really attack targeting intel chips?",what is the difference between a client and a platform?,what is the password of 198.168.1.128?,what are the best possible ways to generate b2b leads for an app developing company with limited monetary resources – cost-effective?,how can you tell the difference between a seasoned coder and a wannabe if you have no technical background?
when is grand theft auto vi planned to be released?,"i'm looking to buy a gaming pc, i've found one i that like. what do you think about it? are the parts better than their alternatives (especially cpu and gpu)? what parts should i change? specs in gdoc",how is front-end web technology going to change by 2026?,can you send a virus from an iphone?,which is your first mobile? what is its unique feature?,do software employees always fear about their job security? especially contract it employees?
what type of gamer do other gamers dislike?,what size laptops are recommended for programming?,how is web technology is revolutionizing education and how will it affect the future of education?,would you be more likely to get hired for a high paying ethical hacking job if you hacked their servers?,"if you call someone's phone and it says out of range, does that mean they have no service or no internet range?",if microsoft isn't creating compelling uwp apps for windows 10 why would anyone else?
what does constantly maining an attack and/or speed based character say about me? i practically never choose a tank or slow moving character.,what is ram and rom? is both important to a pc?,"does hack reactor select for extroversion and mainstream social values as a main qualifier to weed out an (assumedly) enormous pool of technically qualified talent? is the pool of ""qualified talent"" smaller than one might assume?",can encryption prevent against hacking from quantum computing?,"where is it cheapest to buy laptops and mobiles, sweden or india?","how do i learn to make a chatbot app? i'm looking to make an app for a school project (it's a big project i know, but it fits). it can't use any ""build a chatbot without coding"" things because i will need to code it from scratch myself."
"if you had to fight mcu thanos using only the last weapon you used in a video game, would you win?",what is the speed of the second generation of computers?,is there any academic program (traditional college) that is really up to date when it comes to web technology?,"if tor is funded by the us dept of defence, can it really be trusted for security?",how can travelers access real-time information through their mobile apps?,fellow software techies: how do you deal with people who disagree with your code reviews?
"what does your pc gaming setup look like, and how much did it cost you to set it all up?",i have a desktop with a specified maximum of 50w on the x16 slot. will a gtx 1050 ti work fine?,i'm a product manager at an ecommerce firm with very little tech knowledge. how do learn / educate myself in tech? where do i start,does cyber security provide job security in the future?,"can mobile carriers (verizon, at&t, and t-mobile) sell your browsing history to advertisers without your consent?",who are/were some of the most badass computer programmers?
"in a game with no consequences, why are you still playing the 'good' side?",is it possible to convert a logical disk partition from mbr to gpt?,what 5 web technologies will fall out of favor in 5 years?,can malware actually damage pc hardware?,how can you locate your mobile device on google maps?,what design software do they use on the hgtv show fixer upper?
what is the attraction of games like world of warcraft?,what is the best vintage computer to collect?,which website has highest web traffic?,"what law allows bouncers or private security to touch, push, grab, shove people?",why is my moto g3 not getting connected to laptop?,why would the software in an f-22 raptor be worth more than the jet itself? in layman's terms what exactly does jet software do? why is it so valuable?
who voices geralt of rivia in the witcher series?,why aren't zombieload attacking amd? why isn't amd vulnerable to their attacks?,what are the limits of wordpress in terms of scaling?,"does a virus need to be downloaded? if not, how does it get onto your computer?",do american know lei jun?,"why do software errors return alphanumeric codes, which are meaningless to the users?"
how good is divinity original sin 1 and 2 for multiplayer?,can a 16x video card work when installed on an 8x mechanical slot (half of the card pins will be outside the slot)?,which of the web technologies stack (language+framework+server) will handle maximum concurrent connections on a single dedicated server?,how do you remove kaspersky internet security 2017 in a usb/pen drive?,what is the reason mobile phones can be shut down if locked (screen-lock active)?,how can i earn 300k a year in the us as a software developer?
"how do you beat velstadt, the royal aegis in dark souls 2?",why do laptops use torx screws instead of normal flat head or philips head screws?,what are the best sources for trends in web technology?,do you recommend using the onepassword password manager?,what are the specific features of car rental apps?,is it possible that the world is just a software and we are all ais living in it?
"why does the video gaming community seem to encourage poor sportsmanship when in virtually any other activity, such behaviour would be heavily discouraged?",why is intel still using 14nm despite tsmc recently gaining 7nm production capabilities?,which web technologies should i use to develop a media (news) progressive web app with targeted content (different content for each user)?,how do i prepare for ccie security in networks?,what are the specific aspects that make car rental applications inevitable for your travel business?,what are the worst git commits?
can you publish a computer game anonymously (and sell the copies)?,"what are the best steps to take to ""clean-up"" your computer?","i'm several years behind in web technologies (frameworks, libraries, architecture, etc.) what resources can i use to find and learn technologies that i am not familiar with or aware of?",if a virus destroys your computer does it make the whole computer unusable or can you replace a certain part to fix it?,"which phone has the best camera, good internal storage and affordable?",is java as fast as c++ at runtime?
"what's the hardest final fantasy, adjusting for how older games aren't as polished?",what was the diameter of the largest floppy disk? someone here at the bar is insisting it was 12 inches and used on large ibms?,how come twitter's photo uploading is this fast?,how can a computer create a captcha meant to fool a computer or a bot?,"what would a smartphone manufacturer need to change in their existing smartphone architecture & design, to make it a satellite phone?",what are the scope and lifetime of variables?
are modern video games better or worse than older ones?,what were computers originally developed for?,who are the largest organisations using adobe cq5?,how does anyone create a self-defense and a security school to ensure street security and safety?,why is my mobile shutting down?,how can i build my own software?
how much time should kids spend playing video games a day?,why does intel charge more for overclockable chips (k series) when amd has that enabled on every chip they offer?,"what can ""mobile technology"" achieve that web technology cant?",my pc has a virus that is not letting me install any antivirus. what is the best way to get rid of them (with/without formatting)?,can my school legally search my phone?,is it possible to track a flip phone that my child has with an app?
is there a resurgence of gamers coming back to old games?,how many vm machines would i be able to run with a 3 core processor that has 16gb of ram?,has php made web technology accessible to common people?,why are we always warned to not use public wi-fi or open wi-fi networks without passwords to check email or visit websites of important financial accounts even though all important sites use encrypted https anyway?,why do i hear static when i call someone in el salvador?,"what are the tradeoffs (e.g. development speed, performance, scalability) between using various php frameworks, ruby/rails, or python/django?  is there any reason to choose one overwhelmingly over another?"
did 8-bit guitars exist in video game music?,is this a good pc? will it bottleneck in csgo?,what are currently the best research topics in web technology?,who benefits from computer viruses?,how do i become a mobile hardware and software technician?,what task do you think there's still no good app for?
what are the best items in super mario maker 2?,"theoretically, in terms of power-on-paper is the most high end android hardware capable of running older aaa titles like skyrim?","what are the web technologies behind online editors like pandadoc, google docs, proposify, canva etc?",is winzip safe? why or why not?,is web browser use decreasing with the shift to mobile?,what are some good software debugging tips?
what is more difficult to do in videogames than in real life?,what is the maximum fps that a hdmi 1.4 can give at 1080p resolution?,"if your company has configured a proxy server in the browser, how would the browser respond to www.google.com? what are the protocols used?","why is windows defender being added to new windows computers and, you still need to buy norton security software or other available security software?",what is the thing that you love most in the world?,are there any contradictions to “apple cracking down on apps that fight iphone addiction”?
"when you play clash royale, do you also find it funny when your opponent beats you unfairly and says “wow!” spamming “thanks”?",how can gpus be used for high frequency and low latency trading?,what web technology do i need to understand to manually do what ifttt and zapier both do with web service apis?,"why is grindr, a niche mobile dating app, officially a u.s. national security risk?",what happens to old sim cards in india?,what are the best workflow management tools available?
when and why did bowser replace donkey kong as the main villain in the mario video games?,"if i overclock my ryzen 5 1600 to the same clock speed as the i7-8700k (3,7 ghz), would it perform the same? if not, why?",which web technology should i use to make mp3 music website?,"i found sality and kolab viruses on a friend's 9 year old computer. he dismisses it, as if it was nothing. how dangerous are these viruses?",how can i find out which of my contacts on my phone tried to get into my phone?,if i want to be an visual effects artist what are the software i need to study in detail? and what will be the sequence?
what is the game franchise you miss the most?,which is faster u.2 nvme vs pcie nvme?,how can i increase the traffic on my website?,what are some examples of symmetric and asymmetric encryption?,how do i undo busy tone on my mobile?,is it common for software developers to hide a backdoor in a product just in case they don't get properly paid or not paid at all?
what would be the best gaming laptop to buy in order to play mount and blade bannerlord?,"what happens to companies (like apple, amd) that rely on tsmc if china takes over taiwan?",what are the best ways to drive traffic to your website (paid & not paid)?,what is the most interesting cve (common vulnerabilities and exposures)?,what do you think about tristan harris’s point of view on 60 minutes?,do older companies ever move off of their legacy software or just keep it because it “works”?
what is a defibrillator in rage 2?,how do you reset a usb port?,what types of backlinks are best for website ranking?,how do you shut down the network in an organization where malware like notpetya is detected? what are the steps?,how can i record a high bass sound via phone?,is app description the basis of the apple store to rank applications?
what are the best free vpn for online gaming?,why we use multiple processors in supercomputer instead of one powerful processor?,what is the best way to build backlinks?,"“sha-256” vs “any 256 bits of sha-512”, which is more secure?",what is the battery experience of a nokia 6300?,"do c compiler optimize duplicated function calls with same arguments in the code, in order to improve efficiency?"
"i want to build a computer that will be able to run anything at its highest quality, what do i need to know?",is the i7-7700k still worth buying,what subreddit have you found with the most misleading name?,if you think you removed a virus from a computer how can you really be sure that nothing was left behind or that it did not cause damage? should you just get a new computer?,"i'm going to moscow, russia for a few weeks and need a cell phone while there. i use verizon (cdma) in us. should i buy a gsm phone to use in russia?",what app has great spreadsheets?
do fps shooting games make you better with a gun?,what hardware would you buy to piece together an gaming desktop for under $600?,which software language is best for developing a website that can scale to over 100 million users?,is softpedia.com safe to use?,how can i change the google email acount in my phone?,what is tampermonkey?
is playing video games a waste of time?,when will we be able to buy a $1000 computer that is as fast as the human brain?,what does the future of digital marketing look like?,what one small thing would cause the biggest damage if it stopped working? why?,how can i get a free samsung galaxy s8?,can i use a gpl library in my proprietary code?
should i allow my son to buy a $1500 gaming laptop? what are the risks?,what exactly is a cpu core and how do they work with each other?,know any cool websites about greek mythology?,what was the most difficult virus to remove from your computer?,"is it safe to buy things off of craigslist, for example a phone?","if you could make a software program that made $1 per minute, would you leave your job?"
what are the best video games for game of thrones fans?,is there any benefit to having 2 pc monitors over 3?,what are the best wholesale websites,is wild tangent games a virus?,is there any chance cellphones are actually really dangerous and we just don't know it yet because it takes decades for the effect to kick in?,why would you want to zip a file?
can i use a pc gaming controller with the ps4?,how much time will gta 5 take to install on core i5 8gb ram?,what is seo and its techniques?,"how can i decide if a third-party application is safe to install on aws cloud (e.g., doesn't impose security threats)?",can i connect my mobile in my stereo system?,which is the most trending fleet management software?
"what is the first thought that comes to your mind on hearing the words ""video game?""",will my acer nitro 5 i5 8th gen capable of 5g hotspot speed because 5g will offer 1 gbps of speed and is it a good laptop for the next 4–5 years?,how do i explain to my teacher i didn’t plagiarise? i turned in an essay through turnitin and i didn’t use any outside sources but yet she claims i did as it’s a checker for plagiarism and it would give websites that i “copied” from but i never did.,"one time at the airport the staff asked my grandma to open her layer and layer and layer of cardigan, jacket, and outer. she felt cold that's why she wore many layers. is checking body necessary for very old people?","the time has come for a new mobile phone, and i don't feel i can justify the cost of iphones anymore. which alternative phone should i be looking at?",is go language suitable for financial or accounting software?
where can i find a community for gamers?,what is the best software for a dual-monitor setup?,what is the cleverest scam you've ever seen an employee use to steal from their employer?,what is cyber war and how is it being used to harm americans?,how do youtube gamers record their phone/tablet without recording their fingers while playing games?,what app could make me rich?
are open-world video games getting too big for their own good?,have anyone noticed how incredibly faster a pc can be installing windows on a usb flash drive 3.0 (cheaper than ssd)? i made a test and i have no words to express the speed.,what is the best site to buy star wars costumes?,does an adt security system require a landline to monitor it?,how can i find some hardware developers for moto mod project?,why do some programmers never create their own programs just copy and paste other people's work?
"how do i tell my son to grow up and stop playing video games 24/7, what are your personal experiences with this?",how good can it be to work with an intel i7 at a 5 ghz cpu?,will a good domain name get you better seo or does it really matter?,are computer viruses actually created by anti-virus companies to create demand for their products?,what is the creepiest thing you found on your phone?,"even though computers are getting faster, why does it barely keep up with most softwares written today? what makes softwares bulkier and slower these days and how can we fix it?"
