Gamming,Hardware,Internet,Security,Smartphone,Software and App
why do grownups indulge in video games?,"which intel skylake cpu will give me longest battery life? m3, m5 or m7?",when did people stop being polite on the internet?,can i accidentally make a computer virus?,what will the launch of the apple iphone look like in history lessons a century from now?,why do modern 3d rendering softwares render in a twisting pattern instead of the scanline rendering of the past?
does a 144hz display truly provide a better gaming experience over a 60hz?,what’s the best laptop for programmers in 2019?,what layers of hell will be designated for internet bullies?,what's the most secure instant messenger?,i never answer any call if the number is not in my phone contacts (i might answer if they text me first). is this bad?,what computer program has the least lines of code?
what is your favorite video game that was released in 2019? how did you come across this game?,why computers struggle if cooling isn't enough? what exactly happens inside a processor if cooling doesn't happen properly?,does times barners lee get all the credit for creating the internet?,are deadbolt locks safe?,how do you remove mobile internal storage data before repair?,what processor and board do you recommend for learning assembly language?
what games will most likely hold up (or continue to hold up) for the next 20 years?,how many transistors does a typical microprocessor chip contain?,how is internet satellite network by spacex different from other internets?,aren't cyber attacks by china designed to disrupt the security of another country technically considered as an act of aggression or even war?,how manufacturers provide ota update for volte?,what does a gold star mean on snapchat?
what are the minimum system requirements to play total war: three kingdoms?,what businesses use mainframe computers and why do they use them?,"how do you fix slow, overpriced, and sometimes intermittent internet service?",what is block cypher encryption?,how do i get instant definitions of difficult words within an sms message?,what are major misunderstandings about software development?
what is the angriest you've been towards a video game?,what does the process - such as 7nm and 14nm - do on a cpu?,where can i buy trusted adsense valid clicks and safe traffic?,does the us air force's lockheed martin f-22 stealth fighter derive its cyber security from old and obscure agda programming?,"some people cover the webcams on their computers, so shouldn't they cover the cameras on their phones too?","is still worth using github to share free software, considering that now it is owned by microsoft? should we doubt for the future of the open source?"
does playing computer games help with children’s social life?,what is the speed difference between single and dual or even quad channel ram in computers?,"what's the logic behind real long urls, full of (seemingly random) characters and weird punctuation marks?",should i keep a database of all my users’ domain passwords?,which is the best laptop under rs 25000?,what advice for software engineers/ programmers needs to be debunked?
"why is there so much hate for dlc? expansion packs, skin packs, editor programs etc have been sold for computer games since the 80s after all, and i don't recall any particular dislike for them then.",would my laptop work if i put ddr3 memory in?,does the internet need to be fixed?,what technologies do i need to set up modern and secure website?,i gave a stranger my name and cell number. can they do anything with that besides call and text me?,how do you do asynchronous programming in go?
why is ‘minecraft’ still such a popular game?,"should i buy a gpu or ram? my video playback for premiere pro is lagging. my specs are i3-8100 and a 4gb ram. i'm using an integrated gpu, and i’m on a tight budget.","if the world wide web wasn't invented 30 years ago, is it likely we would be using another form of hypertext today?",what do i need to do to protect myself from the may 2019 data breach of whatsapp?,"if a mobile phone is exactly in between two towers (of same service provider, 100 mt apart) , from which tower will it receive and send the signals?",what are some harsh truths a software engineer should gulp and accept?
"you must fight the final boss of each of the last five games you played in a row. you have the abilities of the last video game character you played as, including any upgrades you have. how screwed are you?",why is shutting down a computer with the physical power button bad for the computer but using the on screen button isnt?,"people who correct the grammar and spelling of other people on the internet, why do you do this?",why are there sites online that don't have a secure ssl?,why are indian mobile phone manufacturers not that successful compared to china or america?,have you found a tracking app on your phone? did you find out who put it there?
what's the worst gpu nvidia has ever released?,what should i never do with my computer?,what is an online market place?,what are some good tips for people who want to begin a career in cybersecurity?,i just received an unknown phone call and they stated my personal information to me before i hung up. what should i do?,does it make a programmer weak for using google or stack overflow when coding?
how would you go about making a minecraft replica of the real-world?,does aix require proprietary hardware from ibm?,on the internet why do you think people are more critical in their comments and opinions vs being face to face?,"what is a better protection software, malwarebytes or avast?",which memory card would work well for recording ultra hd videos through a cellphone?,is it more difficult to develop software using windows than other operating systems?
what are the best strategy pc-games?,"how do i get my pc to recognise an external hard drive? using diskmgmt.msc it knows the drive is there, but there is no icon or way of accessing the drive.",what is the first song you ever downloaded off the internet?,why do people still use http though it is not secure?,what was your worst experience with your smartphone?,"as a software engineer, what should do if you regularily get bugs in your code that you don't know how to fix?"
"if you've left fortnite, why?",instead of squeezing more transistors into the same chip why can't we use multiple chips at the same time? four i7s on the same motherboard would give four times the power would it not?,what's the point of tor if i can use a vpn?,why can't software developers design in a way to prevent viruses?,why are cell phones considered to be important?,how should a beginner with knowledge of python start learning data science from scratch on his own?
"microsoft and sony are teaming up for video games in the cloud. does that mean that players could eventually be able to play nearly all games together and against friends, even if they have different game systems? does it also lower console prices?","what are all the differences between non-modular, semi-modular, and fully modular psu’s?",is dsl internet more reliable than cable broadband?,why are backdoors in programming languages not detected before they are released into the wild?,what does paypal pay credit card companies and banks for transferring money to and from customers?,what are all those vastly demanded programmers making? i see a limited use of software.
you are now trapped in the universe of the last video game you played. what is it and how do you feel about it?,"does having an hdmi cable with gold make it better, or is it just a gimmick?","say someone wanted to completely recreate an internet between a number of computers that has no interaction with the current internet or internet service providers, how would one begin to attempt a project like this?",what can i do if i forget my mac password?,what is the best method to learn android?,why are so many people from non-cs background moving to software engineering jobs?
you wake up as an owner of a popular minecraft server (your choice). what do you do?,"my laptop's hard drive is showing smart failure, is it possible to repair the drive?",how is big data analysis and internet of things (iot) related?,how secure is sha1? what are the chances of a real exploit?,is it possible for a hacker to access a phone's camera or microphone if the device is turned off?,what are the best app games to make you smarter?
what is a gamer's worst nightmare?,how is usb-c capable of transfering so much more data and power than previous versions of usb or other interfaces?,has anyone tried to index the dark web?,what makes linux more secure and why we don't need to install antivirus on linux?,why do people choose premium phones?,what's the most destructive software bug in the world?
is there still a future for telltale games and their upcoming games?,what is apple's new fusion drive and is it better than ssd?,why can't we watch the findings of space telescopes in live broadcasting in the internet?,irné barnard,what happened to blackberry?,when is closed source enterprise software better than open source?
have you played rage 2 yet? is it worth the cost?,what did you learn after building your first pc?,what was the first thing you did when you started playing ‘skyrim’ for the first time?,is there any infamous computer bug that cannot be technically debugged?,which network service provider has the best coverage network?,why is java losing popularity?
what are the pros and cons of allowing a preschooler to play some preschool games in phone or computer?,why are there only two major gpu companies?,why should we not use the dark web?,is it required to have an antivirus scanning software in your pc?,i've broken my phone and my mother refuses to pay to get it fixed. what should i do?,"why is microsoft is forgiving about cracked software, or am i wrong and microsoft isn't forgiving about this?"
why do you think people find repetitive video games (like league of legends) so entertaining?,what is raid 0?,"do the homeless of tokyo, japan, sleep in 24-hour internet cafes, since it's cheaper than paying rent?",what is the most malicious thing that you or someone else did in a school's computer lab?,how does google fi work internationally?,is programming a saturated market?
"how can i effectively convey the scale of a large structure in minecraft? i’m working on the outer wall of a dieselpunk city using solid titanium blocks (modded 1.7.10), and each wall is being built in few large sections that resemble solid panels.","is overclocking safe? if it is, why don't cpus and gpu's run at the overclocking speeds out of the box?",why do people who browse topics on the internet think that make them experts?,"how, in layman's terms, do computer hackers attack a system? is there a firm methodical process or is it more haphazard?",why can i never answer my phone immediately when needed?,why is windows famous despite its poor design?
how much golf should one play to get better?,do you prefer track pad or mouse?,is a software that enables user with an internet connection to access and view webpages on a computer or mobile device?,hackers: is it possible to hack into a school system and change your grades?,"if someone blocks you, will they always have your contact info as it is on their block list in general?",my public defender won't use a video that could exonerate me in an assault started by the presumed victim caught on the video do i bring this up before or at trial and to whom in either situation?
what is the appeal of the video game civilization?,is it okay to touch your cpu with bare hands?,where in internet i can find professional marine biologists and professionals in the field of mariculture to get a consultation?,what is the principle used in honeypots?,what is the best way to learn isometric projection?,"what is the best ""to-do"" app/program/web?"
where are the arks in rage 2?,at a certain point will processors have to increase in size rather than decreasing process size?,can my server see my internet activity while using a vpn?,"what password management, strong password techniques or other account security techniques should be utilized when conducting online banking or other financial business online?","why do people in india still work, check their mails or take calls during their weekoffs and during their leaves?",what programming languages are most valued by software companies?
what are the best intel cpus for gtx 1660 ti (no bottleneck)?,just how complex is the base design of a computer?,why does libgen not get taken down?,has a supervirus in a high-security facility ever escaped?,is 80% capacity bad for an iphone battery lifespan?,is it true that companies fire old programmers (around 35ish) to hire young programmers who recently came out of college just because they could pay the young ones a lower salary?
what video game changed your perspective on gaming?,how many microprocessors can fit onto a modern computer chip?,what happens when an internet connection is faster than the storage write speed?,does antivirus actually protect our privacy?,is there any difference between a pre-order and a flash sale of a redmi note 4?,what exactly is tivoization and why did linus torvalds not like it in gplv3?
has anyone ever given up on a fighting video game because the mechanics were flawed?,have you ever bought a used laptop or hard drive that still contained the previous user’s data?,does anyone use brave browser?,what do antiviruses actually do when they scan files? how do they know a file is infected? how do the false positives happen?,do you miss the first mobile phone you used? which model was it?,what are the best apps for salespeople?
is there a cheap but fun multiplayer game for linux that also has cross-platform support? i'm on pc and my boyfriend is on xbox.,are intel xeon processors made from the same die that the i7 is made with?,can you be arrested for using tor networks in the usa?,is hacking apks safe to download for android?,what are some of the best cellular data packages on the us market in 2016?,"if you were given infinite time and a modern computer with all of its standard peripherals and manuals for all the hardware, but absolutely no software, could you bootstrap yourself into an operating system, or would it not be possible?"
what is the all-time best game you've ever played on a console/pc/etc.?,can you use two different brands of ram?,"were you ever a victim of fraud or a scam? if so, what happened?","is malwarebytes an effective alternative to norton, mcafee or eset antivirus? recent marketing claims it provides protection against virus attacks, as well as malware, etc.",what are examples of cute flip phones?,where and how can i get a ready made taxi booking software/website or app (on the lines of ola cab)?
what makes games like mass effect: andromeda and fallout 76 worse than their predecessors?,does the x-ray at airport security damage my,"how does, or how can google stadia address internet bandwidth, speed, and latency response issues with its platform to present an excellent user experience for its customers and players?",how effective are credit card fraud detection sytstems?,what are the various features of car rental software system?,developers say that we will never use what we learn in a standard data structures and algorithms course. still why is it so important that every university curriculum has it as a required subject?
what's the fastest and easiest way to beat minecraft?," electronics in any way? (phone, laptop, etc)?",what do you consider to be one of the coolest pieces of internet history that still exists on the web?,how do i get microsoft to quit calling me to say i have a virus?,i am a 13 year old. should i have a phone?,how quickly are they improving adobe photoshop?
how large is pubg pc file?,is msi b450m pro-vdh a good choice for ryzen 2600?,how do i get unlimited instagram followers?,"if you were edward snowden, what anti-virus software would you run on your computer?",why are cellphones a good way of communication?,what are some movies that were saved from development hell?
should i buy an oculus or vive for vr in 2019?,how many times do you charge your laptop in a week?,why does the nintendo switch hide its internet browser while still having one?,what sort of projects should a security engineering student include in their github profile?,what are the benefits enjoyed by xen or ee in cpwd?,how do i get started developing an app?
what do older people think of the visual graphics that video games have nowadays?,how many cores do intel processors have?,what are the easiest ways to test the internet speed on the ipad?,what is the ransomware attack? how will it affect us and what is the solution?,where do the sar rays come from during telephony?,i lied in a web development interview and said that i have skills that i really don't have. they ended up hiring me 3 days later. what should i do? should i tell them i don't have the skills or should i fake it until i make it?
why is crysis so famous among gamers even after 10 years?,"has the elimination of traditional usb ports in new macbooks been a positive, negative, or non-issue selling point?",what is your fondest memory of the early days of the internet?,which cryptos are ready to resist quantum computer action to break their encryption methods?,will the company take back the reviewed product?,how many cores can actually be used by modern software?
how is the asus x507uf-ej102t for a game designer?,could you build a computer without ram?,does your internet history show up on your phone bill if you delete the history?,"what is specifically, the most secure operating system there is?",what are some ways to root my noir a10?,how should i dress for a software engineering interview?
what are the best games to play for low spec pcs?,how often do you format your personal computers?,how is the internet stored? are there people who have like a million hard drives to store all of the internet so it can be accessed wirelessly?,what do you learn both in white and black hacking courses?,will there always be cellular providers that give you unlimited data?,what are some must have shopify apps?
who is the weirdest video game character?,why did we ever use crt monitors? we had laptops with lcd's in the 90's.,"what was your first internet connection like, and how does your current isp compare?",is it necessary to pay for antivirus protection?,does moto z play indian version have gorilla glass protection in front and which version?,have you used ovia fertility app?
how do different departments communicate with each other when developing a video game?,how much ram is recommended for data scientists to have?,what is the most ridiculous piece of clickbait you’ve ever seen?,"do you use malware and virus protection software and if not, why?",what would it take to be able to vote in an election from my phone?,what is the best way to secure a saas-based web application?
is it possible to put the components of a ps4 into a pc so you can have a high spec pc?,is there a good reason why usb-a connectors were designed to give you only a 50% chance of plugging it in correctly the first time?,how can i fix my computer that is constantly switching the internet from on to off to no internet acces? i have switched ethernet cables and another computer still works.,what are the consequences of conducting a pentest without permission?,is it wise to invest inr 12000/- in 8 different mutual funds per month for atleast 5 years?,"if an swe intern, a junior swe, and a senior swe were all given the same coding task, how would their approaches and resulting code look different?"
what video games can i play to make money?,how can i find the best laptop for a teacher?,how can i get an item approved by google merchant center without having the mpn or gtin? many of these items are antique/vintage (before the internet) items.,how can i get a smart hacker?,what are the best mobile phones in under rs.12000?,in c++ what's the best way to do case-insensitive string comparison?
how do low spec pc gamers survive in this era of modern games?,i spilled milk on my keyboard and it's getting sort of stucky. any ideas on how to fix it?,"what could be the possible reason? website traffic has gone down suddenly from 1,000 users per day to 100 users per day.",why do people that build software leave security gaps? what are the most common security gaps?,"is there a media player which changes the video quality while playing, like youtube?",why do many people complain that google and facebook software engineering interviewers don't care about real experience and only ask entry-level programming problems even though most people have great trouble solving them?
is there any benefit to having 2 pc monitors over 3?,how can a complex circuit like a cpu work with defects?,what is the best dna ancestry test one can purchase on the internet?,i think my husband's computer is infected with malware. should i run malwarebytes on the rest of the computers in our home network?,which head phone supports on mi phone?,how do i stop somebody from viewing the source code of javascript?
"in skyrim, who are the thalmor?",what is your ideal pc build?,how would you explain the importance of net neutrality to someone who is completely computer illiterate?,what would happen if you ran two anti-virus programs at the same time on your computer?,what does it mean for a mobile phone to be dust resistant?,what are the main weaknesses of haskell as a programming language?
what video games are old but still popular?,how do i overclock my i5 8250u safely?,"if i am in nigeria, how can i buy something from the internet?",which free personal computer antivirus software best protects your computer without slowing it down?,what is the present day technology in computer sciences?,"how important is ""naming things well"" in software development?"
do mobile games that promise to pay you for playing actually work?,what are the advantages and disadvantages of a raid setup?,why is the development of tor allowed when it allows illegal activity?,is it secure to store jwt access and refresh tokens in the browser’s local storage?,what is the principle behind wireless charging of mobile phones using microwaves?,is there an app able to type what i say?
what's the guiltiest you've felt after playing a video game?,why do computers get slower over many years of operation? i’ve taken great care of it and made sure to clean it properly.,"my internet always disconnects my desktop computer, while i have a good range and a stable connection. how can i fix that?",what are the best programs for a pc to use against malware?,"on a daily basis, how many people access youtube for the first time as of august 2016?",are you glad you chose a career in computer science?
how was counter strike: global offensive developed?,"if i want to upgrade my laptop's ram to higher ram, do i need to uninstall everything or format my laptop?","my nintendo 3ds’s are unable to connect to the internet, but other devices like tablets and computers can. why is this?",will there be a way to keep windows 7 secure after 2020?,can i get a 1-800 toll-free number for personal use?,"programmers, while you’re programming do you put little hidden details/secrets in software/websites, if so what?"
why do pc gamers use a monitor when a tv has a speaker built-in?,what was the first computer to use a usb port?,"how can i use email without connecting my computer to the internet? my last computer was destroyed when i downloaded a virus by accident, so i have sworn off the internet.",what is the future of the physical security market?,how do phone number resellers get hold of elite memorable phone numbers?,which calling software will be best for a call center in terms of saving money?
why are video games widely considered a bigger waste of time than watching tv?,why is linux always late in hardware drivers after windows and macos while the community is techier?,what is the greatest feat of a random chance/coincidence that you have witnessed on the internet?,are phishing threats restricted to email?,how do i read mobile phone schematics?,why do most desktop applications these days feel like clunky ports of mobile apps or web pages?
what gaming/streaming pc should i build? i have a maximum budget of $ 2500 usd.,"will an ssd provide any benefit if i'm only going to be doing web browsing, watching videos, and doing school work?",is the dark web only accessible through tor browser?,is it possible to get a virus on my website ?,why did nokia lose the mobile market in india?,"what happens when you typecast an int array into char? does it increase the length of the array by 4 times, with each element represent 1 byte versus 4 bytes originally?"
how does playing games tend to make you feel?,is it true that flash drives or sd cards bigger than 16 gb can easily get corrupted?,"what is your earliest memory of being online; compuserve, prodigy, others?",how much does epic games pay to secure my account?,what is the best standard cell phone?,do most programmers put easter eggs in their code? even nasa has found them.
does anyone get a weird feeling in the pit of their gut when they fall from a high spot in a video game while in first person?,"if ssds gets slower after many reads and writes, does ram get slower after many reads and writes?",what are the best domain name registrars? why?,is it possible to break rsa encryption without the private key given an infinitely powerful computer?,what is the next leap forward in smart phones?,is joom a trustworthy app to use for shopping?
